{
  "algorithm": "trice-v2-live-user-conditioned-rollout",
  "artifacts": [
    {
      "bytes": 1671,
      "path": "trice_v2_live_report.md",
      "sha256": "cde391f549b9a04402f8b86928455c51252c1a280a58098555573ea208da590f"
    },
    {
      "bytes": 595,
      "path": "user_profile.json",
      "sha256": "c20e78d231d6db042e3e0957b752e8bfaa067bfc85274fcb26dbcb41afa44a61"
    },
    {
      "bytes": 6244,
      "path": "rename-api/round-1/baseline-full-context/trace.json",
      "sha256": "163165a21d3354ea8127a0f26ade4a95f8b0c60a8ebc73a4cfb1cc7be0be9f7b"
    },
    {
      "bytes": 6217,
      "path": "rename-api/round-1/trice-v2/trace.json",
      "sha256": "1585090319e92942c9e133aca74422c8283f4652bdc434f93baa1499d5a94955"
    },
    {
      "bytes": 3427,
      "path": "rename-api/round-1/trice-v2/context_policy.json",
      "sha256": "345eff361ca87b0d01136b5cb670ce08e538c4aeeb37f530c045f44061dd268a"
    },
    {
      "bytes": 1589,
      "path": "rename-api/round-1/trice-v2/compressed_context.txt",
      "sha256": "c1faab2e3c4761beb52dd7cd88b84969016dcf3514811031f8d31226b1ad3177"
    },
    {
      "bytes": 3682,
      "path": "rename-api/round-1/baseline-full-context/run_receipt.json",
      "sha256": "007c6784bda8655eaee8e45760bc26fe83df5279ba46818f302644aacb8a4bcf"
    },
    {
      "bytes": 4272,
      "path": "rename-api/round-1/trice-v2/run_receipt.json",
      "sha256": "c9780bdfd5521cab520a190ed75c0108e12d2bbd4b696abe6f94f3fb1179e96f"
    }
  ],
  "canonical_result_sha256": "692f063e2f558ba73312caee4d4ebce9a0048fec4bd012c575498dc622a6b825",
  "created_by": "TraceRazor TRICE",
  "notes": [
    "Fresh workspace per condition",
    "Objective verifier command per run",
    "User-conditioned profile captured in result JSON",
    "Verifier durations normalized before hashing",
    "Wall-clock metadata excluded from traces",
    "Run receipts capture adapter envelopes and changed workspace fingerprints",
    "Replay is not accepted as final proof"
  ],
  "platform": "Windows-10-10.0.26200-SP0",
  "python_version": "3.11.6",
  "result_sha256": "a984c82a7b3f73c51e3783ac831d7322f909414adaa1485c3b2912a3e11d77fa",
  "schema_version": "trice-evidence-manifest/v1"
}
