{
  "algorithm": "trice-v2-live-user-conditioned-rollout",
  "artifacts": [
    {
      "bytes": 1677,
      "path": "trice_v2_live_report.md",
      "sha256": "13862f82e09f3ad498618a794d294f335113c7cc43925cc03bc999d92156b403"
    },
    {
      "bytes": 595,
      "path": "user_profile.json",
      "sha256": "8ee64e7a94f726b6c0a92ca926c680b992de56c3020f384b522c0991cb36155f"
    },
    {
      "bytes": 11936,
      "path": "implement-median/round-1/baseline-full-context/trace.json",
      "sha256": "99d84415be983edfd3470d33115c62c9df2f11d5169c9e932433869f07214eb2"
    },
    {
      "bytes": 11909,
      "path": "implement-median/round-1/trice-v2/trace.json",
      "sha256": "49ff82c133ed84dae106b074402e925e519e8770a80fdc98051ea3a7b222ade3"
    },
    {
      "bytes": 3578,
      "path": "implement-median/round-1/trice-v2/context_policy.json",
      "sha256": "a4bd3231cf83090d6f1ecf1f93a7b08008c0d5ab954d88f64b12b5bd10cc1440"
    },
    {
      "bytes": 3178,
      "path": "implement-median/round-1/trice-v2/compressed_context.txt",
      "sha256": "6b5231daf96b4e78d3a81e1bdb02d5425f12e4530a025096e7fe64156b14c51e"
    },
    {
      "bytes": 3644,
      "path": "implement-median/round-1/baseline-full-context/run_receipt.json",
      "sha256": "f1dd9391434a22bee74199ef32e407fa42cb68bc647062fa6fc42c8b2f067964"
    },
    {
      "bytes": 4259,
      "path": "implement-median/round-1/trice-v2/run_receipt.json",
      "sha256": "362ef7b2c813ed611c41a8f5e2649e4b149b4ee23854001aae3407d23be19332"
    }
  ],
  "canonical_result_sha256": "aa20f0cf66b8e0f43638b13f21317822deb211dd51421dc616fe4f79151af4c0",
  "created_by": "TraceRazor TRICE",
  "notes": [
    "Fresh workspace per condition",
    "Objective verifier command per run",
    "User-conditioned profile captured in result JSON",
    "Verifier durations normalized before hashing",
    "Wall-clock metadata excluded from traces",
    "Run receipts capture adapter envelopes and changed workspace fingerprints",
    "Replay is not accepted as final proof"
  ],
  "platform": "Windows-10-10.0.26200-SP0",
  "python_version": "3.11.6",
  "result_sha256": "a330f690eb5ce2742ebfc3f527600358cafb24f73af6728e7a3faf54516e554d",
  "schema_version": "trice-evidence-manifest/v1"
}
