{
  "algorithm": "trice-v2-live-user-conditioned-rollout",
  "artifacts": [
    {
      "bytes": 1741,
      "path": "trice_v2_live_report.md",
      "sha256": "1c09a4e38b2f8ccaa254265c7e6bc64ed4d68218c385dd3e8864eb0d3081f0b4"
    },
    {
      "bytes": 697,
      "path": "user_profile.json",
      "sha256": "3a7fabebd153c6c7c351ff4b722ae960ce687d315738fa5fd604aae88dc96a72"
    },
    {
      "bytes": 8129,
      "path": "fix-imports/round-1/baseline-full-context/trace.json",
      "sha256": "1886d8114f433986ebc2dcfd9eb80052cbe02e0a6b1687d94e305247ce29ca4d"
    },
    {
      "bytes": 7998,
      "path": "fix-imports/round-1/trice-v2/trace.json",
      "sha256": "67a0a7b857e00545cd899e07905000ee6c3c6f981687e7b9d814a1ee627030d7"
    },
    {
      "bytes": 3432,
      "path": "fix-imports/round-1/trice-v2/context_policy.json",
      "sha256": "2ca294f14fdc0e365a1d6b9a5f399d962608567a47ddf452359c64eadf01e584"
    },
    {
      "bytes": 2148,
      "path": "fix-imports/round-1/trice-v2/compressed_context.txt",
      "sha256": "82cbba511201e94d506c4f12e08006ae1a5e049f0d6af9942ceb9ceaf512f0bf"
    },
    {
      "bytes": 2689,
      "path": "fix-imports/round-1/baseline-full-context/run_receipt.json",
      "sha256": "8e43c4ab0393804eb11b57bb62a3c9b51bb6e13f215e2cfcb2f33d0718df261d"
    },
    {
      "bytes": 3244,
      "path": "fix-imports/round-1/trice-v2/run_receipt.json",
      "sha256": "13cd4b6c8337b0713123bb96cff3b74e9ef7ecfbdffba3a8437934f85cdb459b"
    }
  ],
  "canonical_result_sha256": "d617343fa6a4521e741b7b353bcfaa9cd604332d71c7e8cbea59c20c3ec48baf",
  "created_by": "TraceRazor TRICE",
  "notes": [
    "Fresh workspace per condition",
    "Objective verifier command per run",
    "User-conditioned profile captured in result JSON",
    "Verifier durations normalized before hashing",
    "Wall-clock metadata excluded from traces",
    "Run receipts capture adapter envelopes and changed workspace fingerprints",
    "Replay is not accepted as final proof"
  ],
  "platform": "Windows-10-10.0.26200-SP0",
  "python_version": "3.11.6",
  "result_sha256": "f94e66891cc237eddec9b18e5045feeee433daf70235c0e31c73b72f3cbae4b9",
  "schema_version": "trice-evidence-manifest/v1"
}
