{
  "algorithm": "trice-v3-paper-generator",
  "artifacts": [
    {
      "bytes": 24390,
      "path": "trice_v3_research_paper.tex",
      "sha256": "d47394c451a409da605ebcec0311429693920f711c4f3cc3546fdc3301d519d9"
    },
    {
      "bytes": 11713,
      "path": "trice_v3_references.bib",
      "sha256": "7fabbfee1a046856bffb0aad5c8b8ff3c68efbeeed50e1f06cd109981f93e3c9"
    },
    {
      "bytes": 13390,
      "path": "trice_v3_research_paper.pdf",
      "sha256": "c5d1982b11f4f5746d9147c89085fb1bc378ef7c64bd1b2221ba830a1cc96a3d"
    },
    {
      "bytes": 2943,
      "path": "trice_v3_live_savings.svg",
      "sha256": "83e2305eb30c40073d5f32115d30cd181a368096dd3e415997a38b725cb9f363"
    },
    {
      "bytes": 4687,
      "path": "trice_claim_card.json",
      "sha256": "37c7be3e62be245a3bfad3a93302c9a761b0f6f31684150298d6ce90cb2eef77"
    },
    {
      "bytes": 2160,
      "path": "trice_claim_card.md",
      "sha256": "b6ad12c1b0cac9bed2bb3ab07b0f7769b69cc5f56fe649f2a4a37bc90e4651fb"
    },
    {
      "bytes": 1496,
      "path": "trice_claim_card.tex",
      "sha256": "06a1f20fa2166474014fa764fa74ac88a11043664a7a47904e5172010fc8dc4a"
    },
    {
      "bytes": 1568,
      "path": "trice_claim_card.svg",
      "sha256": "66b7bbc434967cb5360fe11012f5b68691a15d7effd2a47ee428d30ee0c25bfe"
    },
    {
      "bytes": 3227,
      "path": "trice_remote_smoke_claim_card.json",
      "sha256": "e296651963ef02ccfde115ab59f0cc87e5d938548878ed63ef8f8660113da641"
    },
    {
      "bytes": 1654,
      "path": "trice_remote_smoke_claim_card.md",
      "sha256": "be853f3ca53854b89891e502cbf633d1dc7779148c1e6223225403e5a17632fb"
    },
    {
      "bytes": 1381,
      "path": "trice_remote_smoke_claim_card.tex",
      "sha256": "81cbffb211294a112e7be30367106e4d9b33bf0aecf28a246becc437f4a5de22"
    },
    {
      "bytes": 1568,
      "path": "trice_remote_smoke_claim_card.svg",
      "sha256": "83f680e0bc7052c66ed02d8049931e9bb823567f1d70151c281986f9d3f1d8dc"
    },
    {
      "bytes": 5903,
      "path": "trice_suite_readiness.json",
      "sha256": "f98e2481ce47a262e618f0adee5481ee7227347e900613bfc68115cc420be1d7"
    },
    {
      "bytes": 2963,
      "path": "trice_suite_readiness.md",
      "sha256": "86164b17f183f21148e3c2862f5fdc93f259d7d9f3384caecf591d1f5d6dd1d0"
    },
    {
      "bytes": 1726,
      "path": "trice_suite_readiness.tex",
      "sha256": "4bf890b988dd6a1bed53cfc6903410a7ac979b065bcc120d123f3975e3ef8dec"
    },
    {
      "bytes": 1541,
      "path": "trice_suite_readiness.svg",
      "sha256": "4d91f8694ce00bade3465790f10815166ae22a9f010eaa1c0f6077cdd014c059"
    },
    {
      "bytes": 7194,
      "path": "trice_protocol_lock.json",
      "sha256": "3e71413180ad94f43be0b6a35717ced48359b75ea382035c524a9b91e5e8296e"
    },
    {
      "bytes": 3426,
      "path": "trice_protocol_lock.md",
      "sha256": "c938a90b13682ff38edcec613d0a0122cc4991263cff8e115e160f61ae6dfe32"
    },
    {
      "bytes": 2178,
      "path": "trice_protocol_lock.tex",
      "sha256": "45cb5edf0cd52ec6a56a46ebac58ccb25682dd374ffbf21490917e89edbb37c8"
    },
    {
      "bytes": 1853,
      "path": "trice_protocol_lock.svg",
      "sha256": "a032e5c73b011aabe47c495ecbaccb10e3b5cb6c6d50b5dbfed91bf21ce33978"
    },
    {
      "bytes": 4605,
      "path": "trice_design_card.json",
      "sha256": "cbdbb49b901d8c51e6e76504cc7f664b86177dc84f1ee7879345bf8d98261a0b"
    },
    {
      "bytes": 1769,
      "path": "trice_design_card.md",
      "sha256": "88159afc3f36b000d171edc58a7b33b596e2e01c456ec02ec7c2b23cdcd49768"
    },
    {
      "bytes": 1088,
      "path": "trice_design_card.tex",
      "sha256": "61490dc79ab347e674338e85adb0df51b8ab03a528e5a6c6e272e56c2361bf83"
    },
    {
      "bytes": 1872,
      "path": "trice_design_card.svg",
      "sha256": "ebd2a666e82bfca46d7f20c85f09bcf7a740a649fef14d131516a0640eb2a171"
    },
    {
      "bytes": 19194,
      "path": "trice_contract_card.json",
      "sha256": "bb25751668e879c2580ce9ea3d818f29850daca679ecdab1f56d617d3d3fdba1"
    },
    {
      "bytes": 3073,
      "path": "trice_contract_card.md",
      "sha256": "1806e4979c8addbdd76d8c2757441cd62cac09966df99c075a7301bebd602bde"
    },
    {
      "bytes": 2281,
      "path": "trice_contract_card.tex",
      "sha256": "d37a849f0ce78c2e189b92e6cbfe10fbc0e8cdc9e6205e936fc04a6ed1f57338"
    },
    {
      "bytes": 2770,
      "path": "trice_contract_card.svg",
      "sha256": "6ed98b209dd913764e381577d381f992c74ccd5e4001ecb87ee559162982fc6c"
    },
    {
      "bytes": 21475,
      "path": "trice_crates_card.json",
      "sha256": "c91d94c89917648a342f296684973e638cc820863025800e316d3bb3c39d6ef0"
    },
    {
      "bytes": 4314,
      "path": "trice_crates_card.md",
      "sha256": "99e8f2ad5e99a449535de0c79f8a794b06a21d7a1ce9e923f41e8ec6c7a5fd12"
    },
    {
      "bytes": 1586,
      "path": "trice_crates_card.tex",
      "sha256": "bccd80f002520bf8768889252ea5af696b9f39ed7e39b003538ca3fbfe57c0fd"
    },
    {
      "bytes": 2098,
      "path": "trice_crates_card.svg",
      "sha256": "2894bb9c8fb51272c8e456c467fdeffb36c4401dc1b6962bf3ea2384f9a41fba"
    },
    {
      "bytes": 13941,
      "path": "trice_install_card.json",
      "sha256": "350c93766564c5bf47ceb91d086474d275565395d6dbc17b2961038f79e90969"
    },
    {
      "bytes": 3340,
      "path": "trice_install_card.md",
      "sha256": "78bc220eab43d670150c78247f099bd25c72b6193b8fd3ecf5d6fa78b9c6b67d"
    },
    {
      "bytes": 1460,
      "path": "trice_install_card.tex",
      "sha256": "9b6330b28f53026142432414b7d9a2928455a27753d7c85d947857480aaf0b48"
    },
    {
      "bytes": 2115,
      "path": "trice_install_card.svg",
      "sha256": "901f3c571b6ffcc6104d86895e5fc41ace76fbbf4fec80efb6df61f909ccf244"
    },
    {
      "bytes": 69670,
      "path": "trice_research_card.json",
      "sha256": "2095432965bb86bb3a559aa2bd2ef3375d688910ea4f00315fb75ac4c6019e18"
    },
    {
      "bytes": 2976,
      "path": "trice_research_card.md",
      "sha256": "4e80e58ca503e9b2231cd3872492d8a62580c221e2c0eab0809de1d40e4a6a6d"
    },
    {
      "bytes": 1934,
      "path": "trice_research_card.tex",
      "sha256": "ba418ccee03bd20ae7974b1a9bc1660aaf62ddea259309da5a628e4ceb69fdb1"
    },
    {
      "bytes": 2709,
      "path": "trice_research_card.svg",
      "sha256": "efaab0fe3c99d58d14a4af53982db595ca6ae512e8e3a2f211df760439ac8a25"
    },
    {
      "bytes": 45815,
      "path": "trice_suite_evidence.trice.zip",
      "sha256": "e00ea3e896b60b26bc9c8323cad7bf879d71452d5b8af54a0d17c2a6308e8709"
    },
    {
      "bytes": 117496,
      "path": "trice_broad_smoke_evidence.trice.zip",
      "sha256": "a43eeac3ba5239031376aa7b3be97e01ccada6c36648faa15e1c2b3e2d2d2564"
    },
    {
      "bytes": 25131,
      "path": "trice_remote_smoke_evidence.trice.zip",
      "sha256": "93f31fc51b6c75279b1dc8a637a46e51c7fd9f2aa3ea0ef45fe9d581ffef493d"
    }
  ],
  "canonical_result_sha256": "327f68bf8d59a2ddd941cbcc85214cac67d57006305bc7d815626c78149fefcc",
  "created_by": "TraceRazor TRICE",
  "notes": [
    "LaTeX source and PDF generated from deterministic live evidence."
  ],
  "platform": "Windows-10-10.0.26200-SP0",
  "python_version": "3.11.6",
  "result_sha256": "edf72f856f37e2c773ffefc31c2ae0b06cab67cc6e456044df3ff03911b58d8a",
  "schema_version": "trice-evidence-manifest/v1"
}
