{
  "algorithm": "trice-v2-live-user-conditioned-rollout",
  "artifacts": [
    {
      "bytes": 1680,
      "path": "trice_v2_live_report.md",
      "sha256": "768d499d67e70637180f537ee429d9fae913425144f97c0a1dca1e52c9c08a31"
    },
    {
      "bytes": 595,
      "path": "user_profile.json",
      "sha256": "1bf701149b1e165044eb4837a50a4f65614dc7e8db0b5424de73461ef19ba56e"
    },
    {
      "bytes": 11181,
      "path": "fix-offby-one-suite/round-1/baseline-full-context/trace.json",
      "sha256": "29af559dc0fa20f9bf520c1adfa885035de90fadf8696054727918f7435de9c3"
    },
    {
      "bytes": 11154,
      "path": "fix-offby-one-suite/round-1/trice-v2/trace.json",
      "sha256": "5dc75b183d84af14eea16bf4a9e9823daa3ecd8c09a452aff8cc54b6fb3795d3"
    },
    {
      "bytes": 3600,
      "path": "fix-offby-one-suite/round-1/trice-v2/context_policy.json",
      "sha256": "819348cec61bc9743c57d7d31a5234fe320738aa13dfc9a26a05283bc867c282"
    },
    {
      "bytes": 3031,
      "path": "fix-offby-one-suite/round-1/trice-v2/compressed_context.txt",
      "sha256": "4b06dce7279842c6f3a901fc257f2f90e104bc9fb6be91324bb34659f5be952a"
    }
  ],
  "canonical_result_sha256": "1f463ce7894dfd309c7580fd508801cff708ec084db31c4162ecd5d7c6ba0df7",
  "created_by": "TraceRazor TRICE",
  "notes": [
    "Fresh workspace per condition",
    "Objective verifier command per run",
    "User-conditioned profile captured in result JSON",
    "Verifier durations normalized before hashing",
    "Wall-clock metadata excluded from traces",
    "Replay is not accepted as final proof"
  ],
  "platform": "Windows-10-10.0.26200-SP0",
  "python_version": "3.11.6",
  "result_sha256": "99440bb2753b780bc4c72ef38a26250f4bc68a23b330fde8a8060885f3a05f51",
  "schema_version": "trice-evidence-manifest/v1"
}
